{
  "name": "hive",
  "description": "Installs/Configures hive",
  "long_description": "# hive chef cookbook\n\nInstalls/Configures hive\n\n## Overview\n\nInstalls/Configures hive\n\n## Recipes \n\n* `default`                  - Base configuration for hive\n\n## Integration\n\nSupports platforms: debian and ubuntu\n\nCookbook dependencies:\n* java\n* hadoop_cluster\n\n\n## Attributes\n\n\n## License and Author\n\nAuthor::                Philip (flip) Kromer - Infochimps, Inc (<coders@infochimps.com>)\nCopyright::             2011, Philip (flip) Kromer - Infochimps, Inc\n\nLicensed under the Apache License, Version 2.0 (the \"License\");\nyou may not use this file except in compliance with the License.\nYou may obtain a copy of the License at\n\n    http://www.apache.org/licenses/LICENSE-2.0\n\nUnless required by applicable law or agreed to in writing, software\ndistributed under the License is distributed on an \"AS IS\" BASIS,\nWITHOUT WARRANTIES OR CONDITIONS OF ANY KIND, either express or implied.\nSee the License for the specific language governing permissions and\nlimitations under the License.\n\n> readme generated by [cluster_chef](http://github.com/infochimps/cluster_chef)'s cookbook_munger\n",
  "maintainer": "Philip (flip) Kromer - Infochimps, Inc",
  "maintainer_email": "coders@infochimps.com",
  "license": "Apache 2.0",
  "platforms": {
    "debian": ">= 0.0.0",
    "ubuntu": ">= 0.0.0"
  },
  "dependencies": {
    "java": ">= 0.0.0",
    "hadoop_cluster": ">= 0.0.0"
  },
  "recommendations": {
  },
  "suggestions": {
  },
  "conflicting": {
  },
  "providing": {
  },
  "replacing": {
  },
  "attributes": {
  },
  "groupings": {
  },
  "recipes": {
    "hive::default": "Base configuration for hive"
  },
  "version": "3.0.4"
}